{
  "schemaVersion": 1,
  "id": "challenge-1",
  "title": "Slow Inventory Service",
  "difficulty": "BEGINNER",
  "estimatedMinutes": 12,
  "scenario": "Storefront displays a product and asks Inventory whether it is in stock. Investigate what happens when Inventory responds very slowly.",
  "learningObjectives": [
    "Measure a steady-state baseline.",
    "Connect response latency to a downstream dependency.",
    "Validate a short timeout and graceful fallback."
  ],
  "guidanceLevel": "FULL",
  "instructions": [
    {
      "step": "MEASURE",
      "title": "Measure the normal system",
      "body": "Start normal traffic and capture a baseline. A baseline is the behavior you expect before a controlled failure."
    },
    {
      "step": "HYPOTHESIZE",
      "title": "State your hypothesis",
      "body": "Describe what you expect a 1500 ms Inventory delay to do, and why."
    },
    {
      "step": "EXPERIMENT",
      "title": "Inject latency",
      "body": "Make Inventory respond 1500 ms slower and measure the effect on Storefront."
    },
    {
      "step": "OBSERVE",
      "title": "Observe the impact",
      "body": "Compare response latency and success rate with your baseline, then record what changed."
    },
    {
      "step": "IMPROVE",
      "title": "Improve and validate",
      "body": "Apply a resilience option and repeat exactly the same latency experiment."
    }
  ],
  "hints": [
    "A useful hypothesis mentions both a metric and the Inventory dependency.",
    "A product page can remain useful even when stock information is temporarily unavailable."
  ],
  "traffic": {
    "endpoint": "/api/products/demo-product",
    "ratePerSecond": 3
  },
  "defaultResilience": {
    "inventoryTimeoutMs": 4000,
    "inventoryFallbackEnabled": false,
    "inventoryRetries": 0
  },
  "workflow": {
    "requiredEvidence": ["BASELINE", "HYPOTHESIS", "FAILURE", "EXPERIMENT", "OBSERVATION", "MITIGATION", "VALIDATION", "CONCLUSION"]
  },
  "failureControls": [
    {
      "id": "inventory-latency-1500",
      "type": "LATENCY",
      "target": "inventory",
      "parameters": { "latencyMs": 1500, "jitterMs": 0 }
    }
  ],
  "resilienceOptions": [
    {
      "id": "long-timeout",
      "label": "Wait up to 10 seconds",
      "description": "The request remains coupled to a slow dependency.",
      "settings": { "inventoryTimeoutMs": 10000, "inventoryFallbackEnabled": false, "inventoryRetries": 0 }
    },
    {
      "id": "retries-only",
      "label": "Retry every request",
      "description": "Retries add load and do not make a slow dependency respond sooner.",
      "settings": { "inventoryTimeoutMs": 2000, "inventoryFallbackEnabled": false, "inventoryRetries": 2 }
    },
    {
      "id": "short-timeout-fallback",
      "label": "Use a short timeout and graceful fallback",
      "description": "Return product details promptly and state that stock information is unavailable.",
      "settings": { "inventoryTimeoutMs": 400, "inventoryFallbackEnabled": true, "inventoryRetries": 0 }
    },
    {
      "id": "ignore-dependency",
      "label": "Ignore the slow dependency",
      "description": "Leave the current behavior unchanged and observe whether it improves.",
      "settings": { "inventoryTimeoutMs": 4000, "inventoryFallbackEnabled": false, "inventoryRetries": 0 }
    }
  ],
  "evaluation": {
    "technical": {
      "minimumSamplesPerSnapshot": 15,
      "failureMustIncreaseP95ByMs": 1000,
      "minimumP95ImprovementPercent": 50,
      "mitigationMinSuccessRate": 0.98,
      "mitigationMaxP95Ms": 700,
      "mitigationRequiresFallback": true
    },
    "conceptual": {
      "fields": {
        "whatChanged": {
          "requiredConcepts": ["latency", "impact"],
          "conceptGroups": {
            "latency": ["latency", "delay", "slow", "slower", "response time"],
            "impact": ["increased", "longer", "degraded", "timeout"]
          }
        },
        "cause": {
          "requiredConcepts": ["dependency"],
          "conceptGroups": {
            "dependency": ["inventory", "downstream", "dependency", "service"]
          }
        },
        "conclusion": {
          "requiredConcepts": ["mitigation"],
          "conceptGroups": {
            "mitigation": ["timeout", "fallback", "graceful degradation", "graceful fallback"]
          }
        }
      }
    }
  }
}
